<!ELEMENT employees (data, employee+)>
<!ELEMENT data (#PCDATA)>
<!ELEMENT employee (id, name, role, dept, salary)>
<!ELEMENT id (#PCDATA)>
<!ELEMENT name (#PCDATA)>
<!ELEMENT role (#PCDATA)>
<!ELEMENT dept (#PCDATA)>
<!ELEMENT salary (#PCDATA)>
